source_id,filename,original_url,archive_locator,publisher,document_title,source_type,retrieval_date,page_coverage,sha256,stated_model_year_applicability,applicable_wheelbase,applicable_roof,applicable_chassis,applicable_drivetrain,evidence_classification,binary_retention,notes
SRC-005,Mercedes-2026-web-july-8.pdf,,slate-engineering-source-archive/sprinter-candidate-geometry/Mercedes-2026-web-july-8.pdf,Westcan Manufacturing,Mercedes Sprinter Aluminum Product Guide,supplier_vehicle_dimension_guide,2026-07-16,1-28; geometry 3-4,CDAB58CC6219F0CAEAE5186483CA81C5D04A3EACF7012E5B3A1EDE2CE2D96ACF,Geometry tables state 2007-2025; 3500XD/4500 coverage begins 2019 where shown,144;170;170 Extended,standard;high,2500;3500;3500XD;4500,not_stated,candidate,Retained outside Git,Supplier publication; not a Mercedes OEM document. MY2026 use is controlled carryover. Original download URL was not recorded.
SRC-006,Measurements-Mercedes-Benz-Sprinter-144.pdf,,slate-engineering-source-archive/sprinter-candidate-geometry/Measurements-Mercedes-Benz-Sprinter-144.pdf,Upfit Supply,Mercedes-Benz Sprinter Regular 144 Wheelbase Vehicle Layout Guide,supplier_vehicle_layout_guide,2026-07-16,1-2,384EBE65098730CADA961B16ECB2F273A43C7D47BA0980EC9F0B5A05D58BB051,No explicit range; copyright 2021,144,standard;high,not_stated,not_stated,candidate,Retained outside Git,Supplier publication; not a Mercedes OEM document. Original PDF URL was not available. MY2026 use is controlled carryover.
SRC-007,Measurements-Mercedes-Benz-Sprinter-170.pdf,,slate-engineering-source-archive/sprinter-candidate-geometry/Measurements-Mercedes-Benz-Sprinter-170.pdf,Upfit Supply,Mercedes-Benz Sprinter Long 170 Wheelbase Vehicle Layout Guide,supplier_vehicle_layout_guide,2026-07-16,1-2,EEE173E4544A33C998EDBA8F28FCD44BBAF04A693F9B71999F60ACB0657C4379,No explicit range; copyright 2021,170,high,not_stated,not_stated,candidate,Retained outside Git,Supplier publication; not a Mercedes OEM document. Original PDF URL was not available. MY2026 use is controlled carryover.
SRC-008,Measurements-Mercedes-Benz-Sprinter-170-Ext.pdf,,slate-engineering-source-archive/sprinter-candidate-geometry/Measurements-Mercedes-Benz-Sprinter-170-Ext.pdf,Upfit Supply,Mercedes-Benz Sprinter Extended 170 Wheelbase Vehicle Layout Guide,supplier_vehicle_layout_guide,2026-07-16,1-2,ACAEBB31572C6C64210542F686EDCAB8B53B80D67E7632221C6C888C718C54C5,No explicit range; copyright 2021,170 Extended,high,not_stated,not_stated,candidate,Retained outside Git,Supplier publication; not a Mercedes OEM document. Original PDF URL was not available. The passenger shelving label is 124.5 in while displayed segment arithmetic totals 125.5 in.
SRC-009,MS144.pdf,,slate-engineering-source-archive/sprinter-candidate-geometry/MS144.pdf,Sterling Fleet Outfitters,MS144 Van Layouts Website,supplier_body_layout_and_compatibility_guide,2026-07-16,1-5; dimensions 1-2,EE3E0023B4242886FB9DFC8CCA8DE2F3BA09526323223F883F493433B1E0E1F9,No fixed range; document warns dimensions may vary by model year,144,standard;high,not_stated,not_stated,candidate,Retained outside Git,Supplier publication; not a Mercedes OEM document. PDF metadata declares AI-generated content. Original PDF URL was not available.
SRC-010,MS-170.pdf,,slate-engineering-source-archive/sprinter-candidate-geometry/MS-170.pdf,Sterling Fleet Outfitters,MS170 High Roof Van Layouts Website,supplier_body_layout_and_compatibility_guide,2026-07-16,1-3; dimensions 1,42D08842D4850DB30CC14C5631C2B192664B6B1AE8031928F22F78DD673C1774,No fixed range; document warns dimensions may vary by model year,170,high,not_stated,not_stated,candidate,Retained outside Git,Supplier publication; not a Mercedes OEM document. PDF metadata declares AI-generated content. Original PDF URL was not available.
SRC-011,MS-170-EXT.pdf,,slate-engineering-source-archive/sprinter-candidate-geometry/MS-170-EXT.pdf,Sterling Fleet Outfitters,MS170 Extended High Roof Van Layouts Website,supplier_body_layout_and_compatibility_guide,2026-07-16,1-3; dimensions 1,D6B1FD902FFEBF3B55EE052E9CB3854A0971FCAFEB1FA1C7DBD8E1BDB410F2FF,No fixed range; document warns dimensions may vary by model year,170 Extended,high,not_stated,not_stated,candidate,Retained outside Git,Supplier publication; not a Mercedes OEM document. PDF metadata declares AI-generated content. Original PDF URL was not available.
